User_id,Username,Gender,Age,Job,Skin_Type,Brand,Product,Kategori,Ingredients,Rating
2537,PrissL,1,47,0,Oily,MURAD,Skin Perfecting Lotion - Blemish Prone/Oily Skin,Lotion,"Water, Dicaprylyl Maleate, C12-15 Alkyl Benzoate, Butylene Glycol, Glycerin, Sorbitan Stearate, Squalane, Stearic Acid, Retinol, Caprylic/Capric Triglyceride, Urea, Yeast Amino Acids, Trehalose, Inositol, Taurine, Betaine, Arnica Montana Flower Extract, Epilobium Angustifolium Flower/Leaf/Stem Extract, Hydrolyzed Soy Flour, Spiraea Ulmaria Extract, Honey (Mel) Extract, Cetearyl Alcohol, Ceteareth-20, Talc, Glycolipids, Sodium Hyaluronate, Panthenol, Lecithin, Avena Sativa (Oat) Kernel Protein, Tocopherol, Magnesium Ascorbyl Phosphate , Chondrus Crispus (Carrageenan) Extract, Dimethicone, Sodium PCA, Allantoin, Sclerotium Gum, Carbomer, Disodium EDTA, Aminomethyl Propanol, Phenoxyethanol, Caprylyl Glycol, Chlorphenesin, Citrus Aurantium Dulcis (Orange) Fruit Extract.",4.3
3871,catwoman77,1,64,1,Oily,ESPA,Lift & Firm Moisturiser,Moisturizer,No Info,4
3533,apresco1,1,54,0,No data,FRESH,Lotus Youth Preserve Moisturizer,Moisturizer,"Water, Glycerin, Propylene Glycol Dicaprylate/Dicaprate, Pentylene Glycol, Cetearyl Alcohol, Caprylic/Capric Triglyceride, Cetearyl Isononanoate, Betaine, Polymethyl Methacrylate, Steareth-21, Ficus Carica (Fig) Fruit Extract, Lepidium Meyenii Root Extract, Citrus Limon (Lemon) Peel Oil, Cucumis Sativus (Cucumber) Fruit Extract, Algae Extract, Nelumbo Nucifera Flower Extract, Hibiscus Esculentus Fruit Extract, Sodium Hyaluronate, Tocopheryl Acetate, Ascorbyl Tetraisopalmitate, Tocopherol, Behenyl Alcohol, Cetearyl Glucoside, Sorbitol, Dimethicone, Sodium PCA, Caprylyl Glycol, Carbomer, Tromethamine, Cetyl Alcohol, Stearyl Alcohol, Butylene Glycol, Xanthan Gum, Caramel, Citric Acid, Potassium Sorbate, Sorbic Acid, Phenoxyethanol, Limonene, Citral.",4.3
3510,annareal,0,40,1,No data,SUNDAY RILEY,Ceramic Slip Cleanser,Cleanser,"Water, Disodium Laureth Sulfosuccinate, Octyldoecanol, Polyacrylate-33, Propanediol, Polygyceryl-2 Caprate, Sodium Cocoyl Isethionate, Montmorillonoite, Kaolin, Olive Oil Polyglyceryl-6 esters, Rice Oil Glycereth-8 esters, Phospholipids, Sodium Lauroamphoacetate, Bisabolol, Pentylene Glycol, Sodium Chloride, Sodium Phytate, Caprylyl Glycol, Dehydeoacetic Acid, Benzoic Acid, Propylene Carbonate, Linalool, Farnesol",4.3
6509,sugarandstuff,0,37,1,Combination,Indie Lee,I-Waken Eye Serum,Eye Cream,No Info,4.5
2000,Mannyqo,1,36,0,Combination,CLINIQUE,Clarifying Lotion 3,Lotion,"Water , Alcohol Denat. , Salicylic Acid , Hamamelis Virginiana (Witch Hazel) , Butylene Glycol , Glycerin , Trehalose , Sodium Hyaluronate , Citric Acid , Sodium Hydroxide , Disodium Edta , Bht , Phenoxyethanol , Benzophenone-4 , Ext. Violet 2 (Ci 60730) , Red 6 (Ci 15850) , Orange 4 (Ci 15510)",4.4
6134,rigius,1,18,0,Oily,ESTEE LAUDER,Advanced Night Repair Synchronized Recovery Complex II,Toner,"Advanced Night Repr Sync Rec Cmp11 Division: El (Estee Lauder)Ingredients: Water , Bifida Ferment Lysate , Methyl Gluceth-20 , Peg-75 , Bis-Peg-18 Methyl Ether Dimethyl Silane , Butylene Glycol , Propanediol , Cola Acuminata (Kola) Seed Extract , Hydrolyzed Algin , Pantethine , Caffeine , Lecithin , Tripeptide-32 , Ethylhexylglycerin , Sodium Rna , Bisabolol , Glycereth-26 , Squalane , Sodium Hyaluronate , Oleth-3 Phosphate , Caprylyl Glycol , Lactobacillus Ferment , Oleth-3 , Oleth-5 , Anthemis Nobilis (Chamomile) , Yeast Extract/Faex/Extrait De Levure , Choleth-24 , Hydrogenated Lecithin , Ceteth-24 , Tocopheryl Acetate , Ethylhexyl Methoxycinnamate , Hexylene Glycol , Carbomer , Triethanolamine , Trisodium Edta , Bht , Xanthan Gum , Phenoxyethanol , Red 4 (Ci 14700) , Yellow 5 (Ci 19140)",4.3
3373,ajbeauty18,0,33,0,No data,SkinCeuticals,C E Ferulic Serum,Serum,No Info,4.4
